product_id,title,handle,vendor,product_type,tags,price_inr,compare_at_price_inr,currency,sku,available,weight_grams,product_url,published_at,created_at,updated_at,description_text,image_urls
8347436843187,"GANESHA CROWN 11""",ganesha-crown-11,Poduvals,,,14500.00,,INR,BRID11TPCGH,True,5200,https://www.poduvals.com/products/ganesha-crown-11,2025-09-29T11:11:22+05:30,2025-09-29T11:11:19+05:30,2026-03-11T10:23:10+05:30,"Celebrate Auspicious Beginnings with the 11-inch Ganesha Crown Statue Material: Hand-cast solid brass Finish: Polished antique gold patina Size: Height – 11 in | Base length – 4 in (approx.) Highlights: A beautifully crafted statue of Lord Ganesha, adorned with an intricately detailed crown, symbolizing wisdom, prosperity, and protection. With his divine presence, Ganesha removes obstacles and ushers in success and harmony. The exquisite detailing on the crown and posture adds a regal touch, making it a stunning centerpiece. Ideal Placement: Perfect for puja rooms, living rooms, office desks, or as an auspicious gift for weddings, housewarmings, and festivals. Care Instructions: Wipe gently with a soft, dry cloth to maintain its shine and antique finish. Avoid using water or harsh cleaners. In the Box: 1 × 11"" Ganesha Crown Brass Statue — securely packed and ready for gifting.","https://cdn.shopify.com/s/files/1/0680/3619/8579/files/p1_9c1de0f3-e20f-4ede-a655-21e552e673ed.png?v=1759124359, https://cdn.shopify.com/s/files/1/0680/3619/8579/files/p12_19494908-5fb0-4ad7-a006-c964d04d86e2.png?v=1759124359, https://cdn.shopify.com/s/files/1/0680/3619/8579/files/p2_f6bc4953-ed7e-42cd-ac5d-d709a2d88f26.png?v=1759124359, https://cdn.shopify.com/s/files/1/0680/3619/8579/files/p3_bd74ab94-bf34-44b5-8485-8219846be494.png?v=1759124357, https://cdn.shopify.com/s/files/1/0680/3619/8579/files/p4_56ce318e-5ea8-443e-bee5-62dc465c24b5.png?v=1759124358"
8347434778803,"VISHNU LAXMI 10""",vishnu-laxmi-sitting-10,Poduvals,,,14300.00,,INR,BRID10TPVLX,True,4740,https://www.poduvals.com/products/vishnu-laxmi-sitting-10,2025-09-29T10:59:14+05:30,2025-09-29T10:59:11+05:30,2026-03-11T10:23:10+05:30,"Celebrate Divine Harmony with the 10-inch Vishnu Lakshmi Sitting Statue Material: Hand-cast solid brass Finish: Rich antique gold patina Size: Height – 10 in | Base length – 5 in (approx.) Highlights: A stunning depiction of Lord Vishnu seated gracefully with Goddess Lakshmi beneath the protective hood of Sheshnag. This beautifully detailed idol represents harmony, prosperity, and divine protection. Vishnu symbolizes preservation and balance, while Lakshmi embodies abundance and wealth, making this statue a sacred symbol of spiritual and material well-being. Ideal Placement: Perfect for puja rooms, living rooms, office spaces, or as a centerpiece during festivals. It also makes a thoughtful and auspicious gift for weddings, housewarmings, and religious occasions. Care Instructions: Wipe gently with a soft, dry cloth to preserve its intricate detailing and antique finish. Avoid water and harsh cleaners. In the Box: 1 × 10"" Vishnu Lakshmi Sitting Brass Statue — securely packed and ready for gifting.","https://cdn.shopify.com/s/files/1/0680/3619/8579/files/p1_3fccc1fe-ec5e-4502-bf90-38971c090341.png?v=1759123626, https://cdn.shopify.com/s/files/1/0680/3619/8579/files/p12_e8452075-4cf3-42ae-b446-71989c3365bd.png?v=1759123628, https://cdn.shopify.com/s/files/1/0680/3619/8579/files/p2_341f792b-e947-4f52-af4e-a24d4c72e3b1.png?v=1759123628, https://cdn.shopify.com/s/files/1/0680/3619/8579/files/p3_8d51ad8e-83fb-44fe-b875-6313eb359ca2.png?v=1759123627, https://cdn.shopify.com/s/files/1/0680/3619/8579/files/p4_1bf3fd98-0c28-4873-a3d8-a0339e381bfd.png?v=1759123627"
8347430846643,JHULA GANESHA TUSK 10'',jhula-ganesha-tusk-10,Poduvals,,,10000.00,,INR,BRID10TPJGT,True,3325,https://www.poduvals.com/products/jhula-ganesha-tusk-10,2025-09-29T10:45:06+05:30,2025-09-29T10:45:03+05:30,2026-03-11T10:23:10+05:30,"Invoke divine blessings of prosperity and wisdom with the 10-inch Jhula Ganesha Tusk Statue. Material: Hand-cast solid brass Finish: Elegant antique gold patina Size: Height – 10 in | Base length – 4 in (approx.) Highlights: A beautifully crafted statue featuring Lord Ganesha seated gracefully on a swing (jhula), supported by intricately designed tusks adorned with traditional motifs and mythical creatures. The swing represents movement and joy, while Ganesha embodies wisdom, success, and the removal of obstacles. This piece symbolizes balance, growth, and auspicious beginnings. Best for: Perfect for home temples, living room decor, festive gifting, or as a centerpiece for cultural and spiritual spaces. Care: Wipe gently with a soft, dry cloth to maintain its rich finish. In the box: 1 × 10"" Jhula Ganesha Tusk Brass Statue (secure, gift-ready packaging).","https://cdn.shopify.com/s/files/1/0680/3619/8579/files/p1_c4b7bfa0-3137-4043-8419-fe0bc1046fc4.png?v=1759122752, https://cdn.shopify.com/s/files/1/0680/3619/8579/files/p12_e925280e-52aa-4fc4-8a52-4fdeb35ab26b.png?v=1759122753, https://cdn.shopify.com/s/files/1/0680/3619/8579/files/p2_601e43e1-7f3d-4c75-b08e-b14f0861c463.png?v=1759122753, https://cdn.shopify.com/s/files/1/0680/3619/8579/files/p3_a112c75c-e76b-4f79-803d-bd75a6572a56.png?v=1759122752, https://cdn.shopify.com/s/files/1/0680/3619/8579/files/p4_a58409d4-fdb9-4659-a624-ff948d92a4cf.png?v=1759122753"
8346345275571,"ANNAPOORNA DEVI 10""",annapoorna-devi-10,Poduvals,,,11200.00,,INR,BRID10TPAPD,True,3960,https://www.poduvals.com/products/annapoorna-devi-10,2025-09-26T13:08:48+05:30,2025-09-26T13:08:46+05:30,2026-03-11T10:23:10+05:30,"Invoke blessings of abundance and nourishment with this 10-inch Annapoorna Devi statue. Material: Hand-cast solid brass Finish: Rich antique gold patina Size: Height – 10 in | Base length – 5 in (approx.) Highlights: Detailed depiction of Goddess Annapoorna (a form of Parvati), holding a pot and ladle, symbolizing the endless provision of food and spiritual sustenance. Represents abundance, prosperity, and the sacredness of food . Best for: Kitchen decor, dining room, home altars ( puja rooms), or thoughtful housewarming gifts. Care: Wipe dry with a soft cloth. In the box: 1 × 10"" Annapoorna Devi Brass Statue.","https://cdn.shopify.com/s/files/1/0680/3619/8579/files/p1_c8dda18e-d25d-4179-85a0-d474f3b06c02.png?v=1758872175, https://cdn.shopify.com/s/files/1/0680/3619/8579/files/p12_0b798f8e-f3f2-4c6a-aa6d-f089cc776505.png?v=1758872175, https://cdn.shopify.com/s/files/1/0680/3619/8579/files/p2_523b984c-d0a3-4522-8d7e-8338e3f31512.png?v=1758872175, https://cdn.shopify.com/s/files/1/0680/3619/8579/files/p3_c3a46578-613a-4f75-abcf-e2f2ae9d0a08.png?v=1758872175, https://cdn.shopify.com/s/files/1/0680/3619/8579/files/p4_c6f8eb83-2865-4ef7-bf37-2aa1644c6c95.png?v=1758872175"
8346339573939,"SHIV PARIVAR 10""",shiv-parivar-10,Poduvals,,,12800.00,,INR,BRID10SPRVR,True,4650,https://www.poduvals.com/products/shiv-parivar-10,2025-09-26T12:35:14+05:30,2025-09-26T12:35:11+05:30,2026-03-11T10:23:10+05:30,"Celebrate divine family harmony with this 10-inch Shiv Parivar statue. Material: Hand-cast solid brass Finish: Rich antique gold patina Size: Height – 10 in | Base length – 5 in (approx.) Highlights: Beautiful depiction of Lord Shiva with Goddess Parvati , their sons Ganesha and Kartikeya , and Shiva's mount Nandi the bull. Symbolizes family unity, prosperity, and devotion. Best for: Home altars ( puja rooms), auspicious decor, or meaningful gifts for weddings and housewarmings. Care: Wipe dry with a soft cloth. In the box: 1 × 10"" Shiv Parivar Brass Statue.","https://cdn.shopify.com/s/files/1/0680/3619/8579/files/p1_b6d8f819-209f-40bc-8c93-ce4e4f664b77.png?v=1758870142, https://cdn.shopify.com/s/files/1/0680/3619/8579/files/p12_bfe617b1-788c-4874-a78a-3e5627be550b.png?v=1758870143, https://cdn.shopify.com/s/files/1/0680/3619/8579/files/p2_e5eed1f0-9b76-4371-997a-13325c8c1a5a.png?v=1758870143, https://cdn.shopify.com/s/files/1/0680/3619/8579/files/p3_9c168a90-8fdc-478d-9c3c-92ae42f2120d.png?v=1758870143, https://cdn.shopify.com/s/files/1/0680/3619/8579/files/p4_b9d6f7b1-9eb5-4a25-ab01-2f8035066178.png?v=1758870143"
8346274496691,"MURUGAN ARCH 8""",murugan-arch-8,Poduvals,,,4600.00,,INR,BRID8TPMRGN,True,1300,https://www.poduvals.com/products/murugan-arch-8,2025-09-26T11:25:14+05:30,2025-09-26T11:25:12+05:30,2026-03-11T10:23:10+05:30,"Embrace divine energy with this 8-inch Murugan in Arch statue. Material: Hand-cast solid brass Finish: Rich antique gold patina Size: Height – 8 in | Base length – 3 in (approx.) Highlights: Detailed depiction of Lord Murugan (Karthikeya) with his vel (spear), set within a beautifully carved prabhavali (arch/aureole). Represents courage, victory, and wisdom. Best for: Home altars ( puja rooms), cultural decor, or auspicious gifts. Care: Wipe dry with a soft cloth. In the box: 1 × 8"" Murugan in Arch Brass Statue.","https://cdn.shopify.com/s/files/1/0680/3619/8579/files/p1_2c4d7112-3381-48b8-aa12-9905e791239e.png?v=1758865987, https://cdn.shopify.com/s/files/1/0680/3619/8579/files/p12_70749a19-902e-4645-93d1-1af76fe5ed66.png?v=1758865987, https://cdn.shopify.com/s/files/1/0680/3619/8579/files/p2_2ec89748-a228-48aa-9161-a3460d340352.png?v=1758865986, https://cdn.shopify.com/s/files/1/0680/3619/8579/files/p3_8d169856-8e03-4dc7-be3a-dd27078a836a.png?v=1758865988, https://cdn.shopify.com/s/files/1/0680/3619/8579/files/p4_66d3067b-6648-44f6-9f2e-7112a01b5034.png?v=1758865986"
8346257981619,BUDHA 8'',budha-np-med-mdtng-8,Poduvals,,,6500.00,,INR,BRID8PCNBM,True,1950,https://www.poduvals.com/products/budha-np-med-mdtng-8,2025-09-26T11:11:47+05:30,2025-09-26T11:11:44+05:30,2026-03-11T10:23:10+05:30,"Bring peace to your space with this 8-inch Meditating Buddha. Material: Hand-cast solid brass Finish: Rich antique gold patina Size: Height – 8 in | Base length – 4 in (approx.) Highlights: Serene meditative posture ( Dhyana Mudra ) and fine detailing. A powerful symbol of inner peace and enlightenment . Best for: Meditation altars, office desks, or thoughtful gifts. Care: Wipe dry with a soft cloth. In the box: 1 × 8"" Meditating Buddha Statue.","https://cdn.shopify.com/s/files/1/0680/3619/8579/files/p1_47935145-0e9c-4503-8dc3-fb7488bbb419.png?v=1758865005, https://cdn.shopify.com/s/files/1/0680/3619/8579/files/p12_40f890c6-fa68-488e-8991-4969a31d7039.png?v=1758865005, https://cdn.shopify.com/s/files/1/0680/3619/8579/files/p2_88e2cab6-1eb8-4bee-92b6-cda14072ea42.png?v=1758865006, https://cdn.shopify.com/s/files/1/0680/3619/8579/files/p3_f3a2f945-ad02-4b7c-a6b5-b6e70c0457db.png?v=1758865005"
8345532989619,MURALI KRISHNA GOW 8'',murali-krishna-gow-8,Poduvals,,,6300.00,,INR,BRID8PCMKG,True,2200,https://www.poduvals.com/products/murali-krishna-gow-8,2025-09-25T16:34:27+05:30,2025-09-25T16:34:23+05:30,2026-03-11T10:23:10+05:30,"Bring divine charm and serenity to your home with Poduvals’ Murali Krishna with Cow , a beautifully handcrafted brass idol symbolizing love, devotion, and harmony. Material: Solid hand-cast brass Finish: Antique gold patina with intricate detailing Size: Height – 8 in | Base length – 4 in (approx.) Design highlights: This exquisite sculpture depicts Lord Krishna playing the flute , accompanied by the sacred cow and peacock. Each element is intricately crafted, from Krishna’s ornaments and crown to the fine detailing of the cow and peacock, making it a timeless piece of devotional art. Best for: Pooja rooms, spiritual corners, gifting for auspicious occasions, or as an elegant décor accent that radiates peace and divinity. Care: Wipe with a soft dry cloth; avoid water or harsh cleaning agents to preserve the antique finish. In the box: 1 × 8"" Brass Murali Krishna Idol (secure, gift-ready packing)","https://cdn.shopify.com/s/files/1/0680/3619/8579/files/p1_4dd09e1f-fc30-414f-9bb4-525610b70151.png?v=1758798567, https://cdn.shopify.com/s/files/1/0680/3619/8579/files/p12.png?v=1758798568, https://cdn.shopify.com/s/files/1/0680/3619/8579/files/p2_0a9a23f5-aa20-4cbb-aba6-5a492469ce74.png?v=1758798461, https://cdn.shopify.com/s/files/1/0680/3619/8579/files/p3_8b65202a-35ae-44d8-8798-285be6f1c131.png?v=1758798616, https://cdn.shopify.com/s/files/1/0680/3619/8579/files/p4_f204d4c2-e333-4318-b1bf-4a5b1516e2bc.png?v=1758798503"
8345510478003,"INFANT PLATE STAND 18""",infant-plate-stand-18,Poduvals,,,9000.00,,INR,BRHD18TPINPLT,True,2950,https://www.poduvals.com/products/infant-plate-stand-18,2025-09-25T16:20:35+05:30,2025-09-25T16:20:31+05:30,2026-03-11T10:23:10+05:30,"Add a statement of charm and elegance to your décor with Poduvals’ 18-inch Infant Plate Stand —a beautifully detailed handcrafted piece symbolizing innocence, grace, and artistic luxury . Material: Hand-cast solid brass Finish: Rich antique gold patina with intricate detailing Size: Height – 18 in | Base length – 3 in (approx.) Design highlights: This exquisite stand features a finely sculpted infant figure with angelic wings and floral motifs, gracefully holding the ornate plate support. The intricate carvings and regal design reflect timeless artistry, while the solid brass construction ensures durability and stability. Best for: Home décor accents, office interiors, gifting, or as a centerpiece for festive and special occasions. Perfect for those who appreciate classic and meaningful handcrafted brass décor. Care: Wipe gently with a soft dry cloth; avoid harsh cleaners and prolonged moisture to preserve the antique finish. In the box: 1 × 18"" Brass Infant Plate Stand (secure, gift-ready packing)","https://cdn.shopify.com/s/files/1/0680/3619/8579/files/P2_cc9ad0fb-13f3-499b-9158-c4ba76ebb36e.png?v=1758797607, https://cdn.shopify.com/s/files/1/0680/3619/8579/files/P1_af39f0a1-0f76-4183-a3b2-07d22d0edaa1.png?v=1758797608, https://cdn.shopify.com/s/files/1/0680/3619/8579/files/P22_e9235e4c-9c7c-4f9e-add6-70f8dce4aa3a.png?v=1758797605, https://cdn.shopify.com/s/files/1/0680/3619/8579/files/P3_59f14ad5-bfe6-4c88-aef9-6742b76f09d7.png?v=1758797608, https://cdn.shopify.com/s/files/1/0680/3619/8579/files/P4_69571804-530e-4d79-b473-da6363be850a.png?v=1758797725"
8345491636403,"BASWARNA 13""",baswarna-13,Poduvals,,,21200.00,,INR,BRHD13TPND,True,7680,https://www.poduvals.com/products/baswarna-13,2025-09-25T16:03:57+05:30,2025-09-25T16:03:51+05:30,2026-03-11T10:23:10+05:30,"Invite divine grace into your space with Poduvals’ 13-inch Baswarna —a grand, beautifully detailed altar piece that symbolizes prosperity, devotion, and tradition . Material: Hand-cast solid brass Finish: Rich antique gold patina with fine detailing Size: Height – 13 in | Base length – 3 in (approx.) Design highlights: An exquisitely crafted piece featuring ornate floral patterns and intricate carvings, embodying both artistic mastery and spiritual significance. The sturdy brass structure ensures durability, while the antique finish enhances its regal presence. Best for: Home mandir, office décor, or as a thoughtful gift for weddings, housewarmings, and festivals. Perfect for those who value meaningful and timeless decorative pieces. Care: Wipe dry with a soft cloth after use; avoid harsh cleaners and prolonged moisture to preserve the patina. In the box: 1 × 13"" Baswarna Brass Nandi (secure, gift-ready packing)","https://cdn.shopify.com/s/files/1/0680/3619/8579/files/p2_2447c125-4ea0-448a-ad38-04c852a90aa5.png?v=1758796711, https://cdn.shopify.com/s/files/1/0680/3619/8579/files/p1_256c4c8f-bc1f-4351-abdd-15c16ffbde2d.png?v=1758796587, https://cdn.shopify.com/s/files/1/0680/3619/8579/files/p22_2a0edfb5-3231-4c44-85c7-862bef8d745f.png?v=1758796586, https://cdn.shopify.com/s/files/1/0680/3619/8579/files/p3_4e618f64-8918-4ce0-94a1-b2f0f01be051.png?v=1758796726, https://cdn.shopify.com/s/files/1/0680/3619/8579/files/p4_3c4f1eb4-61c0-4921-823d-f5b5883f65f2.png?v=1758796713"
8345446154419,PEACOCK HOOKAH POT 8'',peacock-hookah-pot-8,Poduvals,,,9200.00,,INR,BRHD8SWPHP,True,2100,https://www.poduvals.com/products/peacock-hookah-pot-8,2025-09-25T15:19:49+05:30,2025-09-25T15:19:44+05:30,2026-03-11T10:23:10+05:30,"Invite regal elegance into your space with Poduvals’ 8-inch Peacock Hookah Pot—a stunning, beautifully detailed altar piece that adds a touch of luxury and tradition to any setting. Material: Hand-cast solid brass Finish: Antique gold patina highlighting fine carvings Size: Height – 8 in | Base length – 5 in (approx.) Design highlights: A beautifully sculpted peacock with intricately detailed feathers, paired with a functional hookah spout, adding a perfect blend of style and heritage. The sturdy brass base ensures stability while evoking timeless elegance. Best for: Home decor, living room centerpiece, or as a thoughtful gift for housewarmings and special occasions. Ideal for those who appreciate unique, functional art. Care: Wipe dry with a soft cloth after use; avoid harsh cleaners and prolonged moisture to preserve the patina. In the box: 1 × 8"" Peacock Hookah Pot (secure, gift-ready packing)","https://cdn.shopify.com/s/files/1/0680/3619/8579/files/p3_43734a15-cfde-485e-bf31-9dcaa77c92b8.png?v=1758793607, https://cdn.shopify.com/s/files/1/0680/3619/8579/files/p1_d97c03ec-b49a-4e16-ada7-b0c6f98796f9.png?v=1758793607, https://cdn.shopify.com/s/files/1/0680/3619/8579/files/p2_55bd05f1-2b48-419c-94ff-ee11444b12b7.png?v=1758793607, https://cdn.shopify.com/s/files/1/0680/3619/8579/files/p32.png?v=1758793607, https://cdn.shopify.com/s/files/1/0680/3619/8579/files/p4_b6f8b983-6385-4fee-b957-8c2634969f41.png?v=1758793695"
8356443291827,"BALAJI LAXMI 11""",balaji-laxmi-15,Poduvals,,,11800.00,11800.00,INR,BRID15TPBLLX,True,4320,https://www.poduvals.com/products/balaji-laxmi-15,2025-10-18T17:58:04+05:30,2025-10-18T17:58:00+05:30,2026-03-11T10:23:10+05:30,"Balaji Lakshmi Brass Idol – 11 Inch Material: Exquisitely handcrafted from premium solid brass, this idol embodies the divine union of Lord Balaji (Venkateswara) and Goddess Lakshmi, symbolizing wealth, protection, and prosperity. Every element reflects traditional South Indian artistry, rich in spiritual and aesthetic value. Finish: Antique gold polish with intricate detailing that highlights both deities, their adornments, and the symbolic motifs around them — exuding divine grace and serenity. Size: Height – 11 inches | Base – approximately 4 inches Highlights: Depicts Lord Balaji and Goddess Lakshmi together, representing balance between spiritual strength and material abundance. The detailed craftsmanship showcases the divine aura of both deities, from Lord Balaji’s majestic stance to Lakshmi’s serene presence beneath the ornamental canopy. Perfect for temples, home shrines, or decorative spaces, invoking blessings of prosperity, health, and divine protection. A treasured gift for festive occasions, weddings, inaugurations, or spiritual milestones — bringing auspicious energy to any environment. Crafted using traditional lost-wax brass casting methods, ensuring long-lasting durability and timeless beauty. Care Instructions: Wipe gently using a soft, dry cloth. Avoid exposure to moisture and harsh cleaning agents. Apply a light layer of coconut or sesame oil occasionally to preserve its antique sheen. Box Includes: One 11-inch Balaji Lakshmi Brass Idol, carefully packed for safe delivery and ready for worship or elegant display.","https://cdn.shopify.com/s/files/1/0680/3619/8579/files/p1_156a4ef8-1276-41f0-a84b-f3a98af8d00f.png?v=1761646375, https://cdn.shopify.com/s/files/1/0680/3619/8579/files/p12_93f8d027-fc44-4316-8193-b6b07f37ab8d.png?v=1761646375, https://cdn.shopify.com/s/files/1/0680/3619/8579/files/p2_c1558d8a-2a90-4267-bf9e-70efe10a45cb.png?v=1761646343, https://cdn.shopify.com/s/files/1/0680/3619/8579/files/p3_240ab5dd-d635-4926-a6bb-939fe21d03c8.png?v=1761646343, https://cdn.shopify.com/s/files/1/0680/3619/8579/files/p4_02cc0e17-b590-4a93-95e3-90abeeced19e.png?v=1761646342"
8387112370355,GAJA (SET) 2'',gaja-set-2,Poduvals,,,1700.00,1700.00,INR,GJ2,True,180,https://www.poduvals.com/products/gaja-set-2,2025-12-05T17:51:54+05:30,2025-12-05T17:51:49+05:30,2026-03-11T10:23:10+05:30,"Material: Crafted from high-quality solid brass, the Gaja Set features miniature elephant figurines designed with exceptional detail. Each piece is carefully hand-sculpted by skilled artisans, capturing the symbolic elegance, strength, and auspicious energy associated with elephants in Indian tradition. Finish: Finished in a refined antique gold tone that enhances the intricate patterns and embossing. The rich texture and vintage aesthetic make these elephants suitable for any décor — from traditional Indian interiors to modern minimal setups. Size: Height – 2 inches | Length – 1 inch (each elephant) A compact yet visually striking size ideal for table décor, pooja spaces, office desks, showcase arrangements, and gifting hampers. Highlights: Elephants symbolize prosperity, wisdom, protection, and good luck . Beautifully carved saddles, trunks, and ornamental detailing add artistic charm. Perfect for Vastu placement — believed to attract positive energy and financial growth. Ideal décor pair for living rooms, workspaces, study tables, and mandir settings. A thoughtful gift for housewarmings, festivals, weddings, or corporate gifting. Made using traditional brass casting methods to ensure durability and long-lasting shine . Care Instructions: Wipe gently with a soft, dry cloth. Avoid water or chemical-based cleaners. For long-term shine, apply a thin layer of brass polish or coconut oil occasionally. Box Includes: 1 × Pair of GAJA 2"" Solid Brass Elephant Figurines Securely packed and ready for gifting or elegant display.","https://cdn.shopify.com/s/files/1/0680/3619/8579/files/GJ2_754900a0-ddc1-4550-9ebd-0b49cecd4428.png?v=1764937037, https://cdn.shopify.com/s/files/1/0680/3619/8579/files/p2_f25cb044-2cf6-4b1a-b9f5-5a7a07d46198.png?v=1764937039, https://cdn.shopify.com/s/files/1/0680/3619/8579/files/p3_97dbc946-22fc-4d64-bb50-75a1c5335de7.png?v=1764937038, https://cdn.shopify.com/s/files/1/0680/3619/8579/files/p4_364e0a87-f1b3-4b1c-ba68-1960288ea9ea.png?v=1764937038"
8386979922099,BHOLENAAT 1.5'',bholenaat-1-6,Poduvals,,,200.00,,INR,"BH1.,5",True,25,https://www.poduvals.com/products/bholenaat-1-6,2025-12-05T14:09:13+05:30,2025-12-05T14:09:09+05:30,2026-03-11T10:23:10+05:30,"Material: Handcrafted from pure, solid brass, this compact Bholenath idol is sculpted with remarkable precision. Despite its miniature size, every detail—from the serene facial expression to the traditional ornaments—is meticulously crafted by experienced artisans, ensuring authenticity and divine presence in every curve. Finish: Coated in an elegant antique gold finish that enhances its intricate detailing and adds a classic, timeless look. The subtle texture gives the idol a rich, vintage charm, making it perfect for both spiritual spaces and decorative setups. Size: Height – 1.5 inches | Width – 1 inch A perfectly sized miniature idol for desks, car dashboards, pooja shelves, gifting hampers, or travel-friendly spiritual use. Highlights: Symbolizes peace, protection, inner strength, and divine energy . Miniature yet highly detailed depiction of Lord Shiva in a meditative posture. Ideal for compact spaces: work desks, study tables, cars, and small pooja corners. Perfect spiritual gift for festivals, housewarmings, birthdays, or personal blessings. Made using traditional brass casting techniques to ensure durability and lasting shine. Care Instructions: Clean gently with a soft, dry cloth. Avoid exposure to water or harsh cleaning agents. Apply a small amount of brass polish or coconut oil occasionally to retain the rich golden luster. Box Includes: 1 × BHOLENAAT 1.5"" Solid Brass Idol Securely packed to ensure safe delivery and ready for gifting or display.","https://cdn.shopify.com/s/files/1/0680/3619/8579/files/BH1.5_1daae168-20f0-4297-a09a-eda24c0911af.png?v=1764923765, https://cdn.shopify.com/s/files/1/0680/3619/8579/files/p1_7ac18399-6142-429f-8741-9254ea872e2e.png?v=1764923765, https://cdn.shopify.com/s/files/1/0680/3619/8579/files/p2_bb0f3f1f-8f63-4467-acc7-8cccde52b9a4.png?v=1764923765, https://cdn.shopify.com/s/files/1/0680/3619/8579/files/p3_9559bcfc-89bb-4ef0-9677-537eddc37423.png?v=1764923765, https://cdn.shopify.com/s/files/1/0680/3619/8579/files/p4_dee5a2ef-3655-462f-b1b8-a342be642f3d.png?v=1764923765"
