product_id,title,handle,vendor,product_type,tags,price_inr,compare_at_price_inr,currency,sku,available,weight_grams,product_url,published_at,created_at,updated_at,description_text,image_urls
8354794012851,SRIKARA LAXMI NARAYANA 3'',srikara-laxmi-narayana-3,Poduvals,,,2000.00,2000.00,INR,SLN3,True,170,https://www.poduvals.com/products/srikara-laxmi-narayana-3,2025-10-15T13:21:12+05:30,2025-10-15T13:21:09+05:30,2026-03-11T10:23:10+05:30,"Srikara Laxmi Narayana Brass Idol – 3″ Material: Handcrafted solid brass for durability, shine, and traditional significance. Finish: Rich antique gold tone with intricate design details. Size: Height – 3″ | Base – 2″ (approx.) . Highlights: Depicts Lord Vishnu (Narayana) seated with Goddess Lakshmi on Garuda, symbolizing protection, prosperity, and divine grace. Compact and artistically detailed, perfect for home altars, desks, or gifting. Care Instructions: Gently dust with a soft cloth; avoid harsh chemicals; polish with natural agents like lemon or tamarind occasionally to retain shine. Box Includes: 1 × 3″ Srikara Laxmi Narayana Brass Idol, securely packed for gifting or display.","https://cdn.shopify.com/s/files/1/0680/3619/8579/files/p1_378fe06f-7be0-40a6-82bf-67d443656f7a.png?v=1760514539, https://cdn.shopify.com/s/files/1/0680/3619/8579/files/p12_33ba542a-8ab3-4c31-a630-2571ee2d84cc.png?v=1760514541, https://cdn.shopify.com/s/files/1/0680/3619/8579/files/p2_30e00e52-9c34-4a5f-99fa-739fb9d7607f.png?v=1760514539, https://cdn.shopify.com/s/files/1/0680/3619/8579/files/p3_45ada5ba-9b45-4eb5-8f54-7d4fb4961786.png?v=1760514539, https://cdn.shopify.com/s/files/1/0680/3619/8579/files/p4_124ffecd-59e5-46ae-9f2b-cbcd462f1105.png?v=1760514539"
8354792898739,SUDARSHANA CHAKRA 5'',sudarshana-chakra-5,Poduvals,,,6000.00,6000.00,INR,SCKR5,True,460,https://www.poduvals.com/products/sudarshana-chakra-5,2025-10-15T13:13:08+05:30,2025-10-15T13:13:05+05:30,2026-03-11T10:23:10+05:30,"Sudarshana Chakra Panchaloha Idol – 5″ Material: Hand-cast Panchaloha (five sacred metals) for spiritual energy and durability. Finish: Antique bronze patina, highlighting fine details. Size: Height – 5″ | Base – 3″ . Highlights: Depicts Sudarshana Chakra seated in flames for protection and cosmic order. Lost-wax artistry for authentic temple tradition. Trusted for positive vibrations and auspiciousness. Ideal Placement: Place in puja shelf, meditation area, or as a spiritual gift. Care: Gently wipe with dry cloth; buff with coconut oil; avoid water and chemicals. Box Includes: 1 × Sudarshana Chakra 5″ Panchaloha Idol, securely packed.","https://cdn.shopify.com/s/files/1/0680/3619/8579/files/S1_4db31ccc-79fc-413d-8518-c0d5a6828d4e.png?v=1760513980, https://cdn.shopify.com/s/files/1/0680/3619/8579/files/S12_9c360d0d-43ec-4144-ab8e-eb54f6a9a7c1.png?v=1760513981, https://cdn.shopify.com/s/files/1/0680/3619/8579/files/S2_6945dcc4-f4f6-44b8-ad0a-624185a942b4.png?v=1760513981, https://cdn.shopify.com/s/files/1/0680/3619/8579/files/S3_52a202c9-eaa4-4ac1-b10f-6f0b9bf429e4.png?v=1760513981"
8354786803891,"RAM DARBAR (SET) 3""",ram-darbar-set-3,Poduvals,,,3000.00,3000.00,INR,RMDR3,True,300,https://www.poduvals.com/products/ram-darbar-set-3,2025-10-15T13:05:10+05:30,2025-10-15T13:05:07+05:30,2026-03-11T10:23:10+05:30,"Invite Dharma and Harmony with the 3″ Ram Darbar Panchaloha Idol Set Material: Hand-cast Panchaloha alloy (blend of gold, silver, copper, zinc, tin) — revered for bringing balance, well-being, and spiritual prosperity. Finish: Antique bronze-gold patina, highlighting detailed craftsmanship and sacred presence. Size: Height – 3″ | Base width – 2″ (approx.) . Highlights: Finely detailed iconography of Lord Rama (center), Goddess Sita, Lord Lakshman, and Hanuman, capturing the spirit of dharma, devotion, love, and virtue. Every aspect, from crowns and ornaments to expressive postures and features, is meticulously crafted using the lost wax technique — reflecting authenticity and respect for Chola bronze art. Panchaloha alloy is believed to radiate auspicious spiritual energy, protect from negative influences, and support the worshiper’s path to dharma and prosperity. Ideal Placement: Perfect for home puja shelves, temple altars, meditation spaces, or as a meaningful housewarming or festive gift. Recommended to place in the northeast, east, or north corner of your home per Vastu tradition — Lord Rama at center, Sita on his left, Lakshman on his right, and Hanuman bowing with devotion. Care Instructions: Wipe gently with a soft, dry cloth to preserve antique finish and fine detail. Occasionally apply coconut or sesame oil for added luster and a protective layer; avoid immersion in water, harsh chemicals, and excessive sunlight. For deeper cleaning, use natural agents like lemon, tamarind, or Pitambari powder, but rinse quickly and dry thoroughly. In the Box: 1 × 3″ Ram Darbar Panchaloha Set (Rama, Sita, Lakshman, Hanuman, arch/prabhavali) — packaged securely for gifting, worship, or decor.","https://cdn.shopify.com/s/files/1/0680/3619/8579/files/S112.50.34PM.png?v=1760513658, https://cdn.shopify.com/s/files/1/0680/3619/8579/files/S112.50.34PM2.png?v=1760513658, https://cdn.shopify.com/s/files/1/0680/3619/8579/files/S212.50.35PM.png?v=1760513658, https://cdn.shopify.com/s/files/1/0680/3619/8579/files/S312.50.35PM.png?v=1760513658, https://cdn.shopify.com/s/files/1/0680/3619/8579/files/S412.50.35PM.png?v=1760513658"
8354778480819,RADHA KRISHNA (SET) 5'',rkset-5,Poduvals,,,5000.00,5000.00,INR,RKST5,True,500,https://www.poduvals.com/products/rkset-5,2025-10-15T12:58:20+05:30,2025-10-15T12:58:17+05:30,2026-03-11T10:23:10+05:30,"Enchant Your Space with the 5″ Radha Krishna Panchaloha Idol Set Material: Hand-cast Panchaloha alloy (gold, silver, copper, zinc, iron)—a five-metal blend revered for transmitting spiritual energy, longevity, and traditional artistry. Finish: Antique bronze-gold patina, accentuating elegant details and sacred presence. Size: Height – 5″ | Base width – 2″ per figurine (approx.) . Highlights: Graceful set capturing Lord Krishna playing his divine flute and Radha standing in a soft, elegant pose—each sculpture adorned with splendid crowns, expressive features, and detailed attire. Every feature is meticulously hand-carved by skilled artisans using the lost wax process, ensuring each set is unique and vibrant for devotional spaces. Panchaloha alloy amplifies positive vibrations, spiritual focus, and auspiciousness, making this set ideal for daily worship, meditation, or decor. Compact yet striking size makes it well-suited for home altars, work desks, display cabinets, or as a memorable, spiritually rich gift for special occasions. Ideal Placement: Best placed on puja shelves, meditation nooks, or near entryways to invite harmony, love, and divine energies into your environment. Beautiful centerpiece for festive celebrations, temple decor, or meaningful gifting—especially for weddings, housewarmings, and anniversaries. Care Instructions: Dust gently with a soft, dry cloth to preserve antique finish and highlight intricate details. Occasionally apply coconut or sesame oil lightly for continued luster; avoid exposure to water and harsh chemicals. Store in a dry, clean place and minimize frequent handling to maintain original patina. In the Box: 1 × 5″ Radha Krishna Panchaloha Set — carefully packed for gifting, worship, or display.","https://cdn.shopify.com/s/files/1/0680/3619/8579/files/S1_fd38006e-c594-45f5-8a65-a29f81acd67f.png?v=1760513190, https://cdn.shopify.com/s/files/1/0680/3619/8579/files/S12_4a0bc177-b0f9-45d1-baec-39a25f46aa18.png?v=1760513190, https://cdn.shopify.com/s/files/1/0680/3619/8579/files/S2_ccb6b31e-8d82-4ac8-97d3-b7487a5d68ee.png?v=1760513190, https://cdn.shopify.com/s/files/1/0680/3619/8579/files/S3_997a99a6-98bb-4c18-8680-50841a266a5a.png?v=1760513190, https://cdn.shopify.com/s/files/1/0680/3619/8579/files/S4_0e710d1e-d92b-4e0a-b062-7ecf9994b007.png?v=1760513190"
8354774876339,RAM PARIVAR 3'',ram-parivar-3,Poduvals,,,4000.00,,INR,RAMP3,True,400,https://www.poduvals.com/products/ram-parivar-3,2025-10-15T12:50:45+05:30,2025-10-15T12:50:42+05:30,2026-03-11T10:23:10+05:30,"Invite Dharma and Devotion with the 3″ Ram Parivar Panchaloha Statue Material: Hand-cast Panchaloha alloy (gold, silver, copper, zinc, tin)—a sacred blend for auspicious energy, strength, and spiritual balance. Finish: Antique bronze-gold patina, reflecting classic temple and devotional artistry. Size: Height – 3″ | Base width – 3″ (approx.) . Highlights: Intricately detailed ensemble of Lord Shri Ram (center), Goddess Sita, Lord Lakshman, and Hanuman, representing dharma, love, loyalty, and selfless devotion. Iconic tableau of Ram Darbar, featuring majestic attire, expressive features, crowns, bows, and padma (lotus), symbolizing divine rulership and the sanctity of Ayodhya. Handcrafted using the lost wax process for precise craftsmanship, capturing every nuance and grace of this sacred family. Panchaloha material is believed to bring balance, well-being, fortune, and protection to any spiritual or family space. Ideal Placement: Ideal for puja shelves, home altars, meditation corners, office desks, or as a precious gift for festivals, housewarmings, and spiritual occasions. Perfect for Vastu alignment, heritage décor, or as a centerpiece to inspire unity, happiness, and ethical conduct in the household. Care Instructions: Wipe gently with a soft, dry cloth to maintain antique finish and fine detail. Occasionally apply coconut or sesame oil for added sheen; avoid harsh polishes, water immersion, and extended exposure to moisture and sunlight. Store in a dry, clean place or wrap in cotton cloth for long-term preservation; avoid frequent handling to maintain even patina. In the Box: 1 × 3″ Ram Parivar Panchaloha Statue—securely boxed for gifting, daily worship, or display","https://cdn.shopify.com/s/files/1/0680/3619/8579/files/S1_8444b640-459a-4a10-995e-eecd59f1b9f5.png?v=1760512679, https://cdn.shopify.com/s/files/1/0680/3619/8579/files/S12_f4f82f13-dd2c-4ae9-af32-b839fedc3b4e.png?v=1760512680, https://cdn.shopify.com/s/files/1/0680/3619/8579/files/S2_4b5e498f-12dd-4902-8456-e79d9f06613e.png?v=1760512679, https://cdn.shopify.com/s/files/1/0680/3619/8579/files/S3_08baedaf-47a7-4b67-bdba-6fe9302049c0.png?v=1760512680, https://cdn.shopify.com/s/files/1/0680/3619/8579/files/S4_1ad73198-a505-4294-b380-8b6b7e65b6ea.png?v=1760512680"
8354764357811,KARTHIKAYA 6'',muruga-pb-6,Poduvals,,,7500.00,7500.00,INR,MPB6,True,730,https://www.poduvals.com/products/muruga-pb-6,2025-10-15T12:42:05+05:30,2025-10-15T12:42:02+05:30,2026-03-11T10:23:10+05:30,"Embody Courage and Devotion with the 6″ Muruga PB Panchaloha Statue Material: Hand-cast Panchaloha alloy (gold, silver, copper, zinc, and iron)—sacred five-metal blend believed to balance energy and attract blessings. Finish: Antique bronze patina with exquisite golden-brown undertones reflecting time-honored South Indian temple art. Size: Height – 6″ | Base width – 3″ (approx.) . Highlights: Magnificently detailed Lord KARTHIKAYA (Kartikeya/Subramanya) standing in state, adorned with ornate jewelry, traditional crown, and holding his signature Vel (divine spear). Iconic peacock vehicle at the side, rich symbolic elements, and intricate base, all handcrafted in classic Panchaloha artistry for an authentic spiritual presence. Panchaloha composition is revered for its spiritual potency, aiding the worshiper with protection, confidence, good fortune, and tranquility. Perfectly sized for puja rooms, altars, temples, or heritage décor—this larger idol offers a commanding yet graceful focus for daily prayers and festive worship. Ideal Placement: Suited for home altars, meditation halls, office shrines, or as an elegant gift for special occasions such as housewarming, weddings, or spiritual milestones. Care Instructions: Wipe gently with a soft, dry cloth to retain its antique luster and clarity. Occasionally buff with coconut or sesame oil for preserved shine; avoid harsh cleaning agents and do not immerse in water. Keep away from prolonged moisture and direct sun to maintain patina and sacred vibrations. In the Box: 1 × 6″ KARTHIKAYA Panchaloha Statue—carefully packed for gifting, worship, or display","https://cdn.shopify.com/s/files/1/0680/3619/8579/files/S1_ce3fb6d4-a46e-4bb2-a28d-16a8b958a8c0.png?v=1760511969, https://cdn.shopify.com/s/files/1/0680/3619/8579/files/S12_86165c10-c1f6-42c4-b329-99ede1f86b41.png?v=1760511970, https://cdn.shopify.com/s/files/1/0680/3619/8579/files/S2_21fb6d58-4880-4484-842d-2921745e4460.png?v=1760511969, https://cdn.shopify.com/s/files/1/0680/3619/8579/files/S3_21c561a4-7b8c-45b5-a89c-d3fbdb66590e.png?v=1760511969, https://cdn.shopify.com/s/files/1/0680/3619/8579/files/S4_17f78216-c6bc-4e27-ae01-79110fffd3b8.png?v=1760511969"
8354753446067,KARTHIKAYA 3'',muruga-pb-3,Poduvals,,,1500.00,1500.00,INR,MPB3,True,145,https://www.poduvals.com/products/muruga-pb-3,2025-10-15T12:30:09+05:30,2025-10-15T12:30:06+05:30,2026-03-11T10:23:10+05:30,"Invite Divine Valor with the 3″ Kartikaya Panchaloha Statue Material: Hand-cast Panchaloha alloy (gold, silver, copper, zinc, and tin)—a sacred blend for spiritual energy and durability. Finish: Antique bronze patina, showcasing traditional South Indian temple artistry. Size: Height – 3″ | Base width – 2″ (approx.) . Highlights: Exquisitely detailed statue of Lord Kartikeya, depicted standing beneath a beautifully carved temple arch (PB arch). Features iconic divine attributes including the Vel (spear), majestic crown, and specific ornaments, symbolizing protection, courage, and wisdom. Expert lost-wax craftsmanship ensures rich features and traditional symbolism, honoring ancient Tamil traditions. Panchaloha composition invites auspicious energies, balance, and positivity, ideal for both personal worship and home decor. Ideal Placement: Perfect for compact puja shelves, personal altars, meditation corners, study tables, or as a meaningful gift for spiritual occasions and festivals. Suitable for heritage display, travel altars, or as a devotional decor centerpiece, elevating the energy of any space. Care Instructions: Wipe gently with a soft, dry cloth to maintain antique finish and detail. Occasionally buff with coconut or sesame oil for preserved luster and protection. Avoid water immersion, harsh chemicals, or extended sunlight exposure; always handle with clean, dry hands. In the Box: 1 × 3″ Kartikaya Panchaloha Statue—packed safely for gifting, worship, or display.","https://cdn.shopify.com/s/files/1/0680/3619/8579/files/s1_c90062b4-eb9f-4801-917e-f71ab3c8b43d.png?v=1760511452, https://cdn.shopify.com/s/files/1/0680/3619/8579/files/s12_f36e0ea4-c4a6-49cc-808d-5274007a8c59.png?v=1760511452, https://cdn.shopify.com/s/files/1/0680/3619/8579/files/s2_1feb7542-9fe3-4249-bc48-f9c039026e81.png?v=1760511452, https://cdn.shopify.com/s/files/1/0680/3619/8579/files/s3_1d9c91db-76b5-46a9-b72d-f5819e5a3532.png?v=1760511452, https://cdn.shopify.com/s/files/1/0680/3619/8579/files/s4_a8865bd5-2f4c-45dc-a502-2778641f6c02.png?v=1760511452"
8354745712819,MARI AMAN 4'',mari-aman-4,Poduvals,,,2000.00,2000.00,INR,MAA4,True,190,https://www.poduvals.com/products/mari-aman-4,2025-10-15T12:23:33+05:30,2025-10-15T12:23:30+05:30,2026-03-11T10:23:10+05:30,"Invoke Protection and Healing with the 4″ Mari Amman Panchaloha Statue Material: Hand-cast panchaloha alloy (five sacred metals – bronze, copper, tin, silver, and gold), enhancing spiritual and healing energy. Finish: Antique bronze patina, reflecting traditional South Indian temple elegance. Size: Height – 4″ | Base width – 1″ (approx.) . Highlights: Meticulously sculpted idol of Goddess Mariamman, revered as the Mother Goddess, protector, and healer, seated in a powerful posture with her classic crown and weapons. Features unique iconographic details, including serpent hood and divine flower, symbolizing her roles in dispelling diseases and bringing rain and fertility. Crafted using the revered lost wax (Madhuchista Vidhana) process, according to Shilpa Shastra, ensuring authentic artistry and spiritual purity. Panchaloha composition is believed to radiate spiritual energy, protection, and auspiciousness, making it vital for rituals and home worship. Ideal Placement: Perfect for home puja altars, temple sanctums, meditation spaces, work desks, or as a meaningful gift for spiritual occasions and festivals. Suited for rural and urban homes seeking divine protection, healing, and blessings during seasonal changes and community events. Care Instructions: Wipe gently with a soft, dry cloth to preserve patina and detail. Occasionally buff lightly with sesame or coconut oil for added luster and a protective layer. Avoid water immersion, abrasive cleaners, and excessive sunlight; handle with clean hands to maintain sacred energy. In the Box: 1 × 4″ Mari Amman Panchaloha Statue—securely boxed for gifting, worship, or decor.","https://cdn.shopify.com/s/files/1/0680/3619/8579/files/s1_eeb13e63-e18e-47e7-acde-c47095571030.png?v=1760511101, https://cdn.shopify.com/s/files/1/0680/3619/8579/files/s12_bdaeb326-fbef-4e50-9947-c70786bf4ed3.png?v=1760511101, https://cdn.shopify.com/s/files/1/0680/3619/8579/files/s2_cc9f28bb-0608-4723-8200-f844644bbbc1.png?v=1760511100, https://cdn.shopify.com/s/files/1/0680/3619/8579/files/s3_edbdc47f-6212-497f-b8b3-a78c9895d27a.png?v=1760511101, https://cdn.shopify.com/s/files/1/0680/3619/8579/files/s4_691d4472-28ec-4841-a104-9a7b5ceb568d.png?v=1760511103"
8354727198899,LAXMI 3'',laxmi-3,Poduvals,,,2300.00,2300.00,INR,LXMI3,True,219,https://www.poduvals.com/products/laxmi-3,2025-10-15T11:27:35+05:30,2025-10-15T11:27:33+05:30,2026-03-11T10:23:10+05:30,"Experience Divine Abundance with the 3″ Laxmi Panchaloha Statue Material: Hand-cast panchaloha alloy (five sacred metals: copper, brass, iron, silver, and gold) for enhanced spiritual resonance and lasting durability. Finish: Antique bronze-gold patina, offering timeless devotional charm. Size: Height – 3″ | Base width – 2″ (approx.) . Highlights: Exquisitely detailed idol of Goddess Lakshmi seated on a lotus base, symbolizing wealth, purity, and spiritual elegance. Goddess depicted with her signature four hands holding lotus flowers and abundance—bestowing protection, wisdom, and prosperity. Intricate hand-crafted ornaments and features showcase skilled craftsmanship and adherence to heritage Chola traditions. Panchaloha alloy invites auspicious energies, balances space, and amplifies spiritual blessings, ideal for daily worship or collection. Ideal Placement: Perfect for home puja shelves, personal altars, meditation corners, study desks, or as a cherished gift on festive and spiritual occasions. Suited for temples, workspaces, travel altars, or heritage decor—elevates the sacred ambiance with positivity and grace. Care Instructions: Dust gently with a soft, dry cloth to maintain antique finish and clarity of detail; occasional light buffing with coconut oil or lemon juice preserves sheen. Avoid immersion in water, abrasive cleaning agents, and prolonged direct sunlight; always handle with clean, dry hands. In the Box: 1 × 3″ Laxmi Panchaloha Statue—securely boxed for gifting, worship, or display","https://cdn.shopify.com/s/files/1/0680/3619/8579/files/S1_ed8c2128-3504-4759-8759-5facc03ce4ff.png?v=1760507454, https://cdn.shopify.com/s/files/1/0680/3619/8579/files/S12_b6f31298-b688-49f3-9771-a9e2f58557d6.png?v=1760507454, https://cdn.shopify.com/s/files/1/0680/3619/8579/files/S2_d8f4a91d-e59c-45ee-91e6-ffe3233bf8c9.png?v=1760507454, https://cdn.shopify.com/s/files/1/0680/3619/8579/files/S3_c7733f6c-6d4e-4b7e-a900-719ba44b1048.png?v=1760507453, https://cdn.shopify.com/s/files/1/0680/3619/8579/files/S4_9db9b9bc-b176-400b-accf-e3b94f282c3f.png?v=1760507454"
8354719596723,LAXMI 2'',laxmi-2,Poduvals,,,700.00,700.00,INR,LXMI2,True,52,https://www.poduvals.com/products/laxmi-2,2025-10-15T11:14:29+05:30,2025-10-15T11:14:26+05:30,2026-03-11T10:23:10+05:30,"Invite Prosperity with the 2″ Laxmi Panchaloha Statue Material: Hand-cast panchaloha alloy (sacred blend of five metals—copper, brass, iron, silver, and gold) symbolizing spiritual power, durability, and purity. Finish: Antique bronze-gold patina, radiating timeless elegance for your spiritual space. Size: Height – 2″ | Base width – 2″ (approx.) . Highlights: Exquisitely detailed idol of Goddess Lakshmi, seated gracefully on a lotus base with coins, symbolizing wealth, fortune, and auspiciousness. Richly ornamented, featuring iconic attributes like the pot of coins and lotus flowers—every detail meticulously handcrafted for devotional artistry. Panchaloha alloy invites positive vibrations, well-being, and abundance, making it ideal for Vastu and spiritual enrichment. Compact size is perfect for small altars, work desks, cubicles, or as a cherished gift for festivals and spiritual occasions. Ideal Placement: Suited for home puja shelves, study tables, meditation nooks, office desks, or as a thoughtful, blessed gift for occasions such as Diwali, Lakshmi puja, or housewarming. Care Instructions: Dust gently with a soft, dry cloth to retain antique finish. Periodically apply coconut or sesame oil lightly for added luster and protective sheen. Avoid water immersion, abrasive cleaning tools, and harsh chemicals; excessive sunlight may alter coloration. In the Box: 1 × 2″ Laxmi Panchaloha Statue—packed securely for gifting, decor, or daily worship.","https://cdn.shopify.com/s/files/1/0680/3619/8579/files/S1_0be1cd96-94d8-4606-bd54-5c67b117003d.png?v=1760506864, https://cdn.shopify.com/s/files/1/0680/3619/8579/files/S12_4e21f8a8-a609-4dd8-aa22-012aa4e24b5f.png?v=1760506864, https://cdn.shopify.com/s/files/1/0680/3619/8579/files/S2_55cdc3e6-dd8c-4847-8e35-cb4c49b00ecc.png?v=1760506864, https://cdn.shopify.com/s/files/1/0680/3619/8579/files/S3_d015fc30-349e-4ecf-89ca-05a12f7e359c.png?v=1760506864, https://cdn.shopify.com/s/files/1/0680/3619/8579/files/S4_1f10d9d9-3f6b-467a-ab3f-2dca18e5ce15.png?v=1760506864"
8354717008051,LALITA 3'',lalita-3,Poduvals,,,2500.00,2500.00,INR,LAL3,True,232,https://www.poduvals.com/products/lalita-3,2025-10-15T11:07:11+05:30,2025-10-15T11:07:08+05:30,2026-03-11T10:23:10+05:30,"Elevate Your Sacred Space with the 3″ Lalita Panchaloha Statue Material: Hand-cast panchaloha alloy (bronze, copper, tin, silver, gold) for enhanced spiritual potency and resilience. Finish: Antique bronze-gold patina for a timeless appearance. Size: Height – 3″ | Base width – 1″ (approx.) . Highlights: Finely detailed idol of Goddess Lalita (Tripura Sundari), depicted gracefully seated and adorned with traditional ornaments, a majestic crown, and iconic divine weapons, embodying beauty, wisdom, and supreme feminine power. Crafted using the lost wax process according to Shilpa Shastra and South Indian bronze traditions for authentic artistry and spiritual significance. Panchaloha composition is believed to attract positive energy, harmony, and prosperity, making each statue a conduit for divine blessings. Ideal Placement: Suited for compact home altars, meditation nooks, study desks, or as a precious gift for spiritual occasions and festivals. Also ideal for temple installations, travel altars, or as a collectible piece of heritage Hindu art. Care Instructions: Dust gently with a soft, dry cloth to maintain patina and detail; occasionally polish lightly with coconut oil for added sheen. Avoid water immersion, harsh chemicals, and excessive sunlight to preserve finish and sacred energy; always handle with clean, dry hands. In the Box: 1 × 3″ Lalita Panchaloha Statue — carefully boxed for gifting, decor, or daily worship.","https://cdn.shopify.com/s/files/1/0680/3619/8579/files/p1_041600be-b846-40a5-9f73-a12a5ba9bb2b.png?v=1760506232, https://cdn.shopify.com/s/files/1/0680/3619/8579/files/p12_9fad4b40-a930-4898-897d-65b879dbf005.png?v=1760506232, https://cdn.shopify.com/s/files/1/0680/3619/8579/files/p2_f834ed5a-6a3d-43d5-95b3-e21b919b8be2.png?v=1760506232, https://cdn.shopify.com/s/files/1/0680/3619/8579/files/p3_338a9325-aad0-49a6-9dfc-9170b15fc9e3.png?v=1760506232, https://cdn.shopify.com/s/files/1/0680/3619/8579/files/p4_2d41ef86-08db-4b86-8f3d-b5973b0f6188.png?v=1760506233"
