product_id,title,handle,vendor,product_type,tags,price_inr,compare_at_price_inr,currency,sku,available,weight_grams,product_url,published_at,created_at,updated_at,description_text,image_urls
8317934960819,"LAKSHMI GANESH SGSN (SET) 4""",laxmi-ganesh-sgsn-set-5,Poduvals,,,2600.00,,INR,LGS4(1),True,0,https://www.poduvals.com/products/laxmi-ganesh-sgsn-set-5,2025-08-22T13:02:24+05:30,2025-08-22T13:02:20+05:30,2026-03-11T10:23:10+05:30,"Bring home the perfect balance of prosperity and wisdom with this regal Lakshmi–Ganesha pair by Poduvals , each seated on an intricately carved singhasan (royal throne). Material: Hand-cast solid brass Dimensions: Height – 4 in | Base – 4 in (each) Finish: Antique temple-gold patina with crisp jewellery and textile detailing Design highlights: Ganesha in blessing mudra, holding modak and ayudha, seated cross-legged on an ornate throne. Lakshmi (matching piece in the set) seated on singhasan with lotuses in the upper hands and varada/abhaya mudras in the front hands. Rich scrollwork on the throne unifies the pair into a harmonious tableau. Symbolism: Lakshmi bestows wealth & abundance while Ganesha grants buddhi & shubha —together inviting success in new homes, ventures, and festive puja. Ideal placement: Home mandir, living room console, office desk or cash counter; best oriented toward the east or northeast . Care: Dust with a soft dry cloth; avoid water and harsh chemicals. Use a mild brass polish sparingly to preserve the patina. In the box: 2 × 4"" brass idols — Lakshmi (Singhasan) + Ganesha (Singhasan).","https://cdn.shopify.com/s/files/1/0680/3619/8579/files/LGS4_0f486332-d9f3-43f6-98f3-8ddf35705bba.png?v=1755847823, https://cdn.shopify.com/s/files/1/0680/3619/8579/files/p1_54a32a5b-671f-4183-9dfd-64826f6adc8c.png?v=1755847824, https://cdn.shopify.com/s/files/1/0680/3619/8579/files/p2_d3a90012-fc63-4756-a801-c8c67ba147b7.png?v=1755847824, https://cdn.shopify.com/s/files/1/0680/3619/8579/files/p3_20611f8b-0724-414d-bcf7-9d57655d9dae.png?v=1755847824, https://cdn.shopify.com/s/files/1/0680/3619/8579/files/p4_dd31966c-bbb8-44f8-a390-28aa23f574a3.png?v=1755847824"
8317934010547,"LAKSHMI GANESH LOTUS (SET)L 4""",laxmi-ganesh-lotus-setl-5,Poduvals,,,2150.00,,INR,LGLL4(1),True,0,https://www.poduvals.com/products/laxmi-ganesh-lotus-setl-5,2025-08-22T12:56:36+05:30,2025-08-22T12:56:31+05:30,2026-03-11T10:23:10+05:30,"Invite abundance and serenity with this Lakshmi idol from the Laxmi–Ganesh Lotus set, exquisitely handcrafted by Poduvals . Material: Solid handcrafted brass Dimensions: Height – 4 in | Base – 4 in Finish: Antique brass with fine temple-style detailing Design highlights: Goddess Lakshmi seated on a blooming lotus , upper hands holding lotuses, front hands in varada (boon-giving) and abhaya (protection) mudras; ornate halo and a kalash of prosperity at her feet Symbolism: Lakshmi blesses the home with wealth, harmony, and auspicious beginnings . Pair with Lord Ganesha from the set for complete blessings of prosperity and wisdom Ideal placement: Home mandir, entrance console, living room shelf, office desk or cash counter—best in the northeast/east zones Care: Dust with a soft dry cloth; avoid water/chemicals. Use a mild brass polish sparingly to preserve the patina In the box: 1 × 4"" Lakshmi brass idol (Lotus). Ganesha piece available separately to complete the set.","https://cdn.shopify.com/s/files/1/0680/3619/8579/files/LGLL4_4be3ba15-36a7-465a-9bd3-9685ca3a2c90.png?v=1755847340, https://cdn.shopify.com/s/files/1/0680/3619/8579/files/pd1_9a58232a-c819-40a2-bfae-dcf65f51c03a.png?v=1755847342, https://cdn.shopify.com/s/files/1/0680/3619/8579/files/pd2_506b7f9e-1ecc-4b8a-9cd4-954d1a77805d.png?v=1755847341, https://cdn.shopify.com/s/files/1/0680/3619/8579/files/pd3_a72369cb-9d26-4e23-92b5-fbc76f547e77.png?v=1755847341, https://cdn.shopify.com/s/files/1/0680/3619/8579/files/pd4_b9b94e20-a58f-445a-85c0-e37971497a87.png?v=1755847341"
8317931847859,"LAKSHMI GANESH CHWKY (SET) 4""",laxmi-ganesh-chwky-set-5,Poduvals,,,1800.00,,INR,LGC4(1),True,183,https://www.poduvals.com/products/laxmi-ganesh-chwky-set-5,2025-08-22T12:35:17+05:30,2025-08-22T12:35:10+05:30,2026-03-11T10:23:10+05:30,"Invite abundance and auspicious beginnings with this elegant Laxmi–Ganesh duo placed on an ornate chowky , handcrafted by Poduvals . Material: Solid handcrafted brass Dimensions (each on chowky): Height – 4 in | Base – 4 in Finish: Antique brass with temple-style carvings Design highlights: Goddess Laxmi seated with lotuses symbolizing prosperity; Lord Ganesha granting wisdom and success—both presented on a richly carved pedestal ( chowky ) for a classic ceremonial look Symbolism: Laxmi ushers in wealth and harmony; Ganesha removes obstacles—together they bless new homes, offices, and business openings Ideal placement: Home mandir, entrance console, desk, cash counter—preferably in the northeast/east zones Care: Dust with a soft dry cloth; avoid water/chemicals. Use mild brass polish sparingly to maintain the patina In the box: 2 × brass idols (Laxmi & Ganesha) with shared chowky base (4"")","https://cdn.shopify.com/s/files/1/0680/3619/8579/files/LGC4_6405679c-bd25-4c5d-b261-95efb23e4c67.png?v=1755846200, https://cdn.shopify.com/s/files/1/0680/3619/8579/files/p1_f70dccd9-779b-4c44-81e0-3cff461f56a1.png?v=1755846201, https://cdn.shopify.com/s/files/1/0680/3619/8579/files/p2_2ff8918b-8a5e-416a-a4dc-cf98df64d2d5.png?v=1755846201, https://cdn.shopify.com/s/files/1/0680/3619/8579/files/p3_d43a8300-cea1-4cdc-a673-720d9c89f269.png?v=1755846202, https://cdn.shopify.com/s/files/1/0680/3619/8579/files/p4_ca1b4cf3-df08-43aa-804a-4907811b8518.png?v=1755846201"
8317928472755,"LAKSHMI GANESH CHWKY (SET) 4""",laxmi-ganesh-chwky-set-4,Poduvals,,,1800.00,,INR,LGC4,True,183,https://www.poduvals.com/products/laxmi-ganesh-chwky-set-4,2025-08-22T12:02:20+05:30,2025-08-22T12:02:14+05:30,2026-03-11T10:23:10+05:30,"Celebrate abundance and auspicious beginnings with this elegant Lakshmi–Ganesh duo on an ornate chowky , handcrafted by Poduvals . Material: Solid handcrafted brass Dimensions (each on chowky): Height – 4 in | Base – 4 in Finish: Antique brass with temple-style detailing Design highlights: Goddess Laxmi seated with lotuses symbolizing wealth and harmony; Lord Ganesha bestowing wisdom and success; both presented on a carved pedestal ( chowky ) for a classic, ceremonial look Symbolism: Laxmi invites prosperity and flow of fortune; Ganesha removes obstacles—together they bless new homes, businesses, and festive rituals Ideal placement: Home mandir, entrance console, office desk, cash counter, shop altar—especially in the northeast or east zones Care: Dust with a soft dry cloth; avoid water/chemicals. Use mild brass polish sparingly to maintain patina In the box: 2 × brass idols (Laxmi & Ganesha) with shared chowky base (4"")","https://cdn.shopify.com/s/files/1/0680/3619/8579/files/LGC4.png?v=1755844184, https://cdn.shopify.com/s/files/1/0680/3619/8579/files/p1_a6257649-3c90-4a76-97c9-10cf10a36c26.png?v=1755844186, https://cdn.shopify.com/s/files/1/0680/3619/8579/files/p2_87a0f32d-9edf-4e38-8a5a-9ef57b4b1d1b.png?v=1755844186, https://cdn.shopify.com/s/files/1/0680/3619/8579/files/p3_d4b59c24-82c8-4999-81d1-7e339682c6a3.png?v=1755844185, https://cdn.shopify.com/s/files/1/0680/3619/8579/files/p4_141fc2fc-a748-41a8-b5fa-5993e620a50c.png?v=1755844185"
8317924409523,"KUBER 3""",kuber-3,Poduvals,,,1700.00,,INR,KUB3,True,0,https://www.poduvals.com/products/kuber-3,2025-08-22T11:14:39+05:30,2025-08-22T11:14:34+05:30,2026-03-11T10:23:10+05:30,"Invite prosperity and guardianship of wealth with this exquisitely detailed Lord Kuber murti, handcrafted by Poduvals . Material: Solid handcrafted brass Dimensions: Height – 3 in | Base – ~3 in Finish: Antique brass for a rich, temple-style patina Design highlights: Pot-bellied Kuber seated on an ornate chowki; one hand in abhaya (protection) and the other holding an overflowing nidhikumbh (pot of riches); crisp crown, jewels and garment detailing Symbolism: As the divine treasurer, Kuber is revered for attracting wealth, steady cashflow, security and good fortune Ideal placement: Cash counter, office desk, home mandir, study, shop/locker —especially near the north or northeast zone Care: Wipe with a soft dry cloth; avoid water and harsh chemicals. Use mild brass polish sparingly In the box: 1 × Kuber brass idol (3"")","https://cdn.shopify.com/s/files/1/0680/3619/8579/files/KUB3.png?v=1755841329, https://cdn.shopify.com/s/files/1/0680/3619/8579/files/p1_d2d6b199-bcdb-4c27-8782-0d84dbf11826.png?v=1755841331, https://cdn.shopify.com/s/files/1/0680/3619/8579/files/p2_c4e3de70-b8c4-4e9c-8082-862d2a7510db.png?v=1755841331, https://cdn.shopify.com/s/files/1/0680/3619/8579/files/p3_c317eaf9-3e6c-431a-b87d-b0b1648e127c.png?v=1755841330, https://cdn.shopify.com/s/files/1/0680/3619/8579/files/p4_d96f487a-0ea7-4be9-ae1c-d926f1fa0f2c.png?v=1755841331"
8317923492019,GANESHA KAMAL 4'',ganesha-kamal-4,Poduvals,,,2200.00,,INR,KGLS4,True,200,https://www.poduvals.com/products/ganesha-kamal-4,2025-08-22T11:07:06+05:30,2025-08-22T11:07:02+05:30,2026-03-11T10:23:10+05:30,"Bring the blessings of Shri Ganesh to your space with this finely detailed Ganesha seated on a lotus (Kamal) , handcrafted by Poduvals . Material: Solid handcrafted brass Dimensions: Height – 4 in | Base – ~2 in Finish: Antique brass for a rich, temple-inspired look Design highlights: Four-armed Ganesha seated on a sculpted lotus, with ankusha (goad), parashu (axe), modak bowl and abhaya mudra ; ornate crown, beaded jewelry and crisp motifs across the robe and seat Symbolism: Ganesha removes obstacles and ushers in prosperity; the lotus signifies purity, growth and auspicious beginnings Ideal placement: Pooja room, work desk, bookshelf or entry console; perfect for Griha Pravesh, Diwali or business openings Care: Wipe with a soft dry cloth; avoid water/chemicals. Use a mild brass polish sparingly if desired In the box: 1 × Ganesha Kamal brass idol (4"")","https://cdn.shopify.com/s/files/1/0680/3619/8579/files/KGLS4.png?v=1755840723, https://cdn.shopify.com/s/files/1/0680/3619/8579/files/p1_994ff8cd-6641-48f9-9967-3215df30e721.png?v=1755840724, https://cdn.shopify.com/s/files/1/0680/3619/8579/files/p5_7d84b812-a61b-4395-8bc6-97bcdcf2905c.png?v=1755840725, https://cdn.shopify.com/s/files/1/0680/3619/8579/files/pp1.png?v=1755840725, https://cdn.shopify.com/s/files/1/0680/3619/8579/files/ppp1.png?v=1755840725"
8317919756467,COW MATA 4'',hanumanji-4,Poduvals,,,2500.00,,INR,GMA4,True,230,https://www.poduvals.com/products/hanumanji-4,2025-08-22T10:24:34+05:30,2025-08-22T10:24:30+05:30,2026-03-11T10:23:10+05:30,"Invite purity, abundance, and gentle protection into your space with this lovingly detailed Gau Mata (cow) with calf sculpture, handcrafted by Poduvals . Material: Solid handcrafted brass Dimensions: Height – 4 in | Length/Base – ~2 in Finish: Warm antique brass for a traditional temple look Design highlights: Sacred cow nursing her calf, ornate saddle work and jewelry motifs—symbolizing nourishment, prosperity, and motherly grace Ideal placement: Home mandir, living room console, office desk, or as a thoughtful Griha Pravesh/Diwali gift Care: Wipe with a soft dry cloth; avoid water and harsh chemicals. Use mild brass polish sparingly if needed In the box: 1 × Gau Mata with Calf brass idol (4"")","https://cdn.shopify.com/s/files/1/0680/3619/8579/files/GMA4_30cc3f6a-cb06-4e23-b4e8-a92e970f8efd.png?v=1755837975, https://cdn.shopify.com/s/files/1/0680/3619/8579/files/p1_ec35dd6e-e91e-43f0-9eb6-282e9d849238.png?v=1755837976, https://cdn.shopify.com/s/files/1/0680/3619/8579/files/p2_8d5e960c-fe2a-4f1f-a33e-a6c3e0276dd2.png?v=1755837977"
8317557801139,HANUMANJI 3'',hanumanji-3,Poduvals,,,500.00,,INR,HAN3,True,380,https://www.poduvals.com/products/hanumanji-3,2025-08-21T18:07:34+05:30,2025-08-21T18:07:28+05:30,2026-03-11T10:23:10+05:30,"Invoke courage, devotion, and protection with this finely detailed standing Hanumanji in anjali mudra (prayer posture), handcrafted by Poduvals . Material: Solid handcrafted brass Dimensions: Height – 3 in | Base – ~1 in Finish: Antique/oxidized brass for a temple-style look Design highlights: Standing Hanuman with halo and traditional ornaments, symbolizing strength, humility, and unwavering bhakti Ideal placement: Home mandir, study/office desk, entry console, or as a thoughtful Griha Pravesh/Diwali gift Care: Wipe with a soft dry cloth; avoid water and harsh chemicals. Use mild brass polish sparingly if needed In the box: 1 × Hanumanji brass idol (3"")","https://cdn.shopify.com/s/files/1/0680/3619/8579/files/HAN3.png?v=1755779811, https://cdn.shopify.com/s/files/1/0680/3619/8579/files/p1_d768f0b9-71a1-4951-95d5-d880d61d8b66.png?v=1755779812, https://cdn.shopify.com/s/files/1/0680/3619/8579/files/p2_43d59cbf-546b-4a19-b971-1a0e04865526.png?v=1755779812, https://cdn.shopify.com/s/files/1/0680/3619/8579/files/p3_949c7277-e419-4c4c-a749-c4430a0dcca4.png?v=1755779812, https://cdn.shopify.com/s/files/1/0680/3619/8579/files/p4_1dbc8f3f-1105-4cb7-aaba-ef5e84d1a179.png?v=1755779812"
8317521658035,GANESHA 2'',ganesaah2,Poduvals,,,300.00,,INR,GH2,True,36,https://www.poduvals.com/products/ganesaah2,2025-08-21T17:22:35+05:30,2025-08-21T17:22:27+05:30,2026-03-11T10:23:10+05:30,"Invite wisdom, prosperity, and auspicious beginnings with this finely handcrafted Brass Lord Ganesha from Poduvals . Material: Premium solid brass with crisp hand-done detailing Dimensions: Height – 2 inches | Width – 1 inch Design: Four-armed Ganesha seated on a lotus pedestal , bestowing blessings and holding traditional symbols with a modak —signifying intellect, protection, and abundance Finish: Antique silver polish for a rich, devotional look Ideal For: Pooja rooms, office desks, car dashboards, return gifts, and festive/house-warming gifting Care: Wipe with a soft dry cloth; avoid water and harsh chemicals Compact yet powerful, this little Vighnaharta idol brings positivity and removes obstacles wherever it is placed.","https://cdn.shopify.com/s/files/1/0680/3619/8579/files/GH2.png?v=1755776938, https://cdn.shopify.com/s/files/1/0680/3619/8579/files/p1_b0db70f0-367f-41ef-bffe-efbdcece0ad0.png?v=1755776938, https://cdn.shopify.com/s/files/1/0680/3619/8579/files/p2_11947eee-ace1-4bde-9f33-15ccb65e646c.png?v=1755776938, https://cdn.shopify.com/s/files/1/0680/3619/8579/files/p3_d9f78ef7-39e4-414d-a961-0fd24599ec7b.png?v=1755776938, https://cdn.shopify.com/s/files/1/0680/3619/8579/files/p4_bba9b879-0201-485e-873b-1ae9162039b6.png?v=1755776940"
8317511696563,GANESHA 2'',ganeshaa-2,Poduvals,,,325.00,,INR,GA2,True,41,https://www.poduvals.com/products/ganeshaa-2,2025-08-21T16:52:11+05:30,2025-08-21T16:52:03+05:30,2026-03-11T10:23:10+05:30,"Invite wisdom, success, and auspicious beginnings with this finely handcrafted Brass Lord Ganesha from Poduvals . Material: Premium solid brass with crisp hand-carved detailing Dimensions: Height – 2 inches | Width – 1 inch Design: Four-armed Ganesha seated on a lotus pedestal , offering blessings while holding traditional symbols and a modak —signifying protection, intellect, and prosperity Finish: Antique silver polish for a rich, devotional look Ideal For: Pooja rooms, office desks, car dashboards, return gifts, and festive/home-warming gifting Care: Wipe with a soft dry cloth; avoid water and harsh chemicals Compact yet powerful, this little Vighnaharta idol brings positivity and removes obstacles wherever it is placed.","https://cdn.shopify.com/s/files/1/0680/3619/8579/files/GA2.png?v=1755775219, https://cdn.shopify.com/s/files/1/0680/3619/8579/files/p1_6ee5b7bb-312c-4a75-a289-fee1aace12ab.png?v=1755775219, https://cdn.shopify.com/s/files/1/0680/3619/8579/files/p2_37c98571-c22e-405c-8f29-1344987ce9d1.png?v=1755775220, https://cdn.shopify.com/s/files/1/0680/3619/8579/files/p3_6fa3a37f-29a5-4dbd-b5d4-84a85edfeeab.png?v=1755775220, https://cdn.shopify.com/s/files/1/0680/3619/8579/files/p4_ce96e488-1674-4520-b793-9a98b7c9c28f.png?v=1755775219"
8317505798323,GANESHA 1.5,ganesha-1-5,Poduvals,,,300.00,,INR,GA1.5,True,35,https://www.poduvals.com/products/ganesha-1-5,2025-08-21T16:44:03+05:30,2025-08-21T16:43:55+05:30,2026-03-11T10:23:10+05:30,"Bring blessings of success and new beginnings with this finely handcrafted Brass Lord Ganesha from Poduvals . Material: Premium solid brass with crisp detailing Dimensions: Height – 1.5 inches | Width – 1 inch Design: Seated four-armed Ganesha on an ornate pedestal, offering abhaya (blessing) while holding traditional symbols and a modak —signifying wisdom, protection, and prosperity Finish: Antique silver polish for a rich, devotional look Ideal For: Pooja rooms, office desks, car dashboards, travel altars, return gifts, and festive gifting Compact yet auspicious, this little Vighnaharta idol invites positivity and removes obstacles wherever it is placed.","https://cdn.shopify.com/s/files/1/0680/3619/8579/files/GA1.5.png?v=1755774638, https://cdn.shopify.com/s/files/1/0680/3619/8579/files/p1_23e6b21b-9b73-49d5-ae31-6b246f82f8fd.png?v=1755774639, https://cdn.shopify.com/s/files/1/0680/3619/8579/files/p2_3c6bc4dd-5504-478b-94d8-f4f392f4664e.png?v=1755774639, https://cdn.shopify.com/s/files/1/0680/3619/8579/files/p3_fcc01b5e-268b-4df3-91e3-b74d812dcf93.png?v=1755774639, https://cdn.shopify.com/s/files/1/0680/3619/8579/files/p4_946970fc-6c3a-409a-b503-e4af51309d3d.png?v=1755774639"
8317422370995,DURGA MAA 7'',durga-maa-7,Poduvals,,,5700.00,,INR,DMAA7,True,1020,https://www.poduvals.com/products/durga-maa-7,2025-08-21T14:21:53+05:30,2025-08-21T14:21:48+05:30,2026-03-11T10:23:10+05:30,"Invoke courage, protection, and victory with this exquisitely handcrafted Brass Durga Maa Idol from Poduvals . Material: Premium solid brass with crisp, hand-tooled detailing Dimensions: Height – 7 inches | Width – 3 inches Design: Maa Durga standing with her lion (Simha) , multiple arms bearing the trishul, chakra, khadga and other divine symbols; ornate halo and temple jewelry on a sturdy pedestal Finish: Antique silver polish for a striking, devotional look Ideal For: Pooja rooms, home temples, living spaces, office desks, and Navratri/housewarming gifting Revered as the embodiment of Shakti , this form of Durga is believed to dispel negativity and bless the home with strength, prosperity, and protection.","https://cdn.shopify.com/s/files/1/0680/3619/8579/files/DMAA7.png?v=1755766195, https://cdn.shopify.com/s/files/1/0680/3619/8579/files/p1_ba67b512-0263-49f2-8fac-4b3b84976423.png?v=1755766198, https://cdn.shopify.com/s/files/1/0680/3619/8579/files/p2_47b00ebc-6d4c-4b3b-b587-24dc04d126c8.png?v=1755766197, https://cdn.shopify.com/s/files/1/0680/3619/8579/files/p3_af3e4779-b483-4e01-90bd-78f47d3d32ff.png?v=1755766196, https://cdn.shopify.com/s/files/1/0680/3619/8579/files/p4_f47900bb-0c98-461f-9ecd-1b1dfee22449.png?v=1755766198"
8317415358643,DURGA MAA 4'',durga-maa-4,Poduvals,,,2200.00,,INR,DMAA4,True,200,https://www.poduvals.com/products/durga-maa-4,2025-08-21T14:16:22+05:30,2025-08-21T14:16:17+05:30,2026-03-11T10:23:10+05:30,"Invoke courage, protection, and victory with this exquisitely handcrafted Brass Durga Maa Idol from Poduvals . Material: Premium solid brass with intricate detailing Dimensions: Height – 4 inches | Width – 2 inches Design: Maa Durga majestically riding her lion (Simha) , with multiple arms holding the trishul, chakra, khadga and other divine symbols—embodying shakti and fearlessness Finish: Antique golden polish for a rich, devotional look Ideal For: Pooja rooms, home temples, office desks, car dashboards, and Navratri/housewarming gifting This compact yet powerful murti is believed to dispel negativity and bestow strength, prosperity, and protection upon your home.","https://cdn.shopify.com/s/files/1/0680/3619/8579/files/DMAA4.png?v=1755765931, https://cdn.shopify.com/s/files/1/0680/3619/8579/files/p1_4fe4e21e-0bf7-4c38-b973-e9208d4bf374.png?v=1755765932, https://cdn.shopify.com/s/files/1/0680/3619/8579/files/p2_20142c79-757e-4d58-a04b-0f56634fc5af.png?v=1755765932, https://cdn.shopify.com/s/files/1/0680/3619/8579/files/p3_9ef0c2d7-afee-4477-bc9b-9c00b1eb5266.png?v=1755765931, https://cdn.shopify.com/s/files/1/0680/3619/8579/files/p4_e3d30e27-7b27-4b7d-a774-1347f25fe68c.png?v=1755765932"
8317414604979,"COW KRISHNA 3""",cow-krishna-3,Poduvals,,,1300.00,,INR,CKH3,True,120,https://www.poduvals.com/products/cow-krishna-3,2025-08-21T14:11:36+05:30,2025-08-21T14:11:32+05:30,2026-03-11T10:23:10+05:30,"Bring home melody, compassion, and divine protection with this beautifully handcrafted Brass Cow Krishna Idol from Poduvals . Material: Premium solid brass with intricate hand-carved detailing Dimensions: Height – 3 inches | Width – 2.5 inches Design: Sri Krishna playing the flute beside a serene cow (Gau Mata) on an ornate pedestal—symbolizing love, harmony, and guardianship of all beings Finish: Antique golden/brass polish for a rich, devotional look Ideal For: Pooja rooms, home temples, living room décor, office desks, and thoughtful gifting for Janmashtami/housewarmings This graceful Gopala form is believed to fill the home with peace and auspicious vibrations—an elegant centerpiece for daily worship and décor.","https://cdn.shopify.com/s/files/1/0680/3619/8579/files/CKH3.png?v=1755765647, https://cdn.shopify.com/s/files/1/0680/3619/8579/files/P1_fc7579f7-b1e5-4973-94e8-1683a1e5bd67.png?v=1755765648, https://cdn.shopify.com/s/files/1/0680/3619/8579/files/P2_44bd6971-6089-4561-b8e1-8c61f534eeea.png?v=1755765648, https://cdn.shopify.com/s/files/1/0680/3619/8579/files/P3_43f070ca-0c5b-4ecc-a2e6-38b721b68dec.png?v=1755765648, https://cdn.shopify.com/s/files/1/0680/3619/8579/files/P4_7111358c-f129-4e96-b38e-0ed22615f0e7.png?v=1755765649"
8317413818547,"BALMURI GANESH 5""",balmuri-ganesh-5,Poduvals,,,5900.00,,INR,BRID5SWBLGH,True,450,https://www.poduvals.com/products/balmuri-ganesh-5,2025-08-21T14:04:22+05:30,2025-08-21T14:04:18+05:30,2026-03-11T10:23:10+05:30,"Invoke powerful blessings for success and protection with this exquisitely handcrafted Balmuri (right-curved trunk) Ganesha from Poduvals . Material: Premium solid brass with intricate hand-carved detailing Dimensions: Height – 5 inches | Width – 3 inches Design: Lord Ganesha seated on a lotus base , holding parashu (axe) and a bowl of modaks , with the sacred Balmuri/right-curved trunk —revered for its energizing, auspicious vibrations Finish: Antique golden polish for a rich, traditional look Ideal For: Home temples, office desks, entrances, festive décor, and auspicious gifting Considered a potent form of Vighnaharta , Balmuri Ganesha is believed to remove obstacles and attract prosperity, courage, and decisive progress—an inspiring centerpiece for daily worship.","https://cdn.shopify.com/s/files/1/0680/3619/8579/files/BRID5SWBLGH.png?v=1755765169, https://cdn.shopify.com/s/files/1/0680/3619/8579/files/p11_252db0a8-e6af-4708-9a21-b48282c61b5c.png?v=1755765171, https://cdn.shopify.com/s/files/1/0680/3619/8579/files/p22_408fdbd9-328d-4e6a-92d1-d65ae82ef204.png?v=1755765171, https://cdn.shopify.com/s/files/1/0680/3619/8579/files/p33_d7c795a7-6b94-4712-8fe0-3fc21b73b7e8.png?v=1755765170, https://cdn.shopify.com/s/files/1/0680/3619/8579/files/p44_d53ff368-120c-44d4-977f-ac8a0afaf193.png?v=1755765170"
8317413228723,BALAJI2'',balaji2,Poduvals,,,200.00,,INR,BL2,False,66000,https://www.poduvals.com/products/balaji2,2025-08-21T13:58:30+05:30,2025-08-21T13:58:25+05:30,2026-03-11T10:23:10+05:30,"Invite prosperity and divine grace with this finely handcrafted Brass Balaji Idol from Poduvals . Material: Premium solid brass with intricate detailing Dimensions: Height – 2 inches | Width – 1 inch Design: Lord Venkateswara (Tirupati Balaji) in the traditional standing posture with ornate crown, temple jewelry, and sacred namam —a symbol of abundance and steadfast protection Finish: Antique brass polish for a rich, devotional look Ideal For: Pooja rooms, home temples, office desks, car dashboards, travel altars, and auspicious gifting This compact idol of Sri Venkateswara Swamy radiates serenity and prosperity—perfect for daily worship and as a meaningful gift.","https://cdn.shopify.com/s/files/1/0680/3619/8579/files/BL2.png?v=1755764844, https://cdn.shopify.com/s/files/1/0680/3619/8579/files/p1_451a8af3-c3f8-4f9f-ba2e-3439ac79208e.png?v=1755764845, https://cdn.shopify.com/s/files/1/0680/3619/8579/files/p2_d07e2451-0a7d-468c-aef0-b620b3ca84e9.png?v=1755764844, https://cdn.shopify.com/s/files/1/0680/3619/8579/files/p3_397fcbac-7809-457a-839a-31abe5b2e933.png?v=1755764845, https://cdn.shopify.com/s/files/1/0680/3619/8579/files/p4_47235150-d3a6-4742-b57b-c367cbb2e47e.png?v=1755764845"
